{
  "$schema": "../../docs/schemas/proof-artifact.schema.json",
  "version": 1,
  "source": {
    "chainId": 1,
    "chainKey": 3,
    "transactionHash": "0x60f65e8b0b14daf28495f367ed8f46ade4ebabec4e4b13c86a3f55a7b2f34245",
    "blockNumber": 25881095,
    "transactionIndex": 186,
    "rpcBlockLogIndex": 516,
    "receiptLogPosition": 2,
    "emitter": "0xc9e1a09622afdb659913fefe800feae5dbbfe9d7"
  },
  "decodedExpected": {
    "topic0": "0x0559884fd3a460db3073b7fc896cc77986f16e378210ded43186175bf646fc5f",
    "topics": [
      "0x0559884fd3a460db3073b7fc896cc77986f16e378210ded43186175bf646fc5f",
      "0x0000000000000000000000000000000000000000000000000000000005f5b911",
      "0x000000000000000000000000000000000000000000000000000000000000048e"
    ],
    "data": "0x000000000000000000000000000000000000000000000000000000006a96860b",
    "roundId": "1166",
    "answer": "99989777",
    "updatedAt": 1788249611,
    "receiptStatus": "success"
  },
  "proof": {
    "sdkVersion": "0.18.0",
    "chainKey": 3,
    "headerNumber": 25881095,
    "txIndex": 186,
    "txHash": "0x60f65e8b0b14daf28495f367ed8f46ade4ebabec4e4b13c86a3f55a7b2f34245",
    "txBytes": "0x0000000000000000000000000000000000000000000000000000000000000002000000000000000000000000000000000000000000000000000000000000004000000000000000000000000000000000000000000000000000000000000000030000000000000000000000000000000000000000000000000000000000000060000000000000000000000000000000000000000000000000000000000000078000000000000000000000000000000000000000000000000000000000000008a00000000000000000000000000000000000000000000000000000000000000700000000000000000000000000000000000000000000000000000000000001a64200000000000000000000000000000000000000000000000000000000000b4aa00000000000000000000000007663c5790e1ebf04197245d541279d13f3c2f36200000000000000000000000000000000000000000000000000000000000000000000000000000000000000006d53d5e35f5226a1613877e071b81217387ac6b5000000000000000000000000000000000000000000000000000000000000000000000000000000000000000000000000000000000000000000000000000000e000000000000000000000000000000000000000000000000000000000000005e46fadcf72000000000000000000000000c9e1a09622afdb659913fefe800feae5dbbfe9d700000000000000000000000000000000000000000000000000000000000000400000000000000000000000000000000000000000000000000000000000000564b1dc65a40001ba57841f89e462d56961c9e46c301b4356b48ba908f2a0b4cb602a7558ec00000000000000000000000000000000000000000000000000000000009a35067bed20252af830e2cf6ad20f32a00a4d9be84b4acd18edf48f542d682f24c8ee00000000000000000000000000000000000000000000000000000000000000e000000000000000000000000000000000000000000000000000000000000003a00000000000000000000000000000000000000000000000000000000000000480010101010101000000000000000000000000000000000000000000000000000000000000000000000000000000000000000000000000000000000000000002a0000000000000000000000000000000000000000000000000000000006a9685fd0a0c0e0d0805010f04000906070b0302000000000000000000000000000000000000000000000000000000000000000000000000000000000000000000000080000000000000000000000000000000000000000000000000000000000000000000000000000000000000000000000000000000000000000000000000000000100000000000000000000000000000000000000000000000000000000005f5ac0d0000000000000000000000000000000000000000000000000000000005f5ac100000000000000000000000000000000000000000000000000000000005f5ac840000000000000000000000000000000000000000000000000000000005f5ac840000000000000000000000000000000000000000000000000000000005f5b5d20000000000000000000000000000000000000000000000000000000005f5b5d20000000000000000000000000000000000000000000000000000000005f5b5d20000000000000000000000000000000000000000000000000000000005f5b5d20000000000000000000000000000000000000000000000000000000005f5b9110000000000000000000000000000000000000000000000000000000005f5ba670000000000000000000000000000000000000000000000000000000005f5ba670000000000000000000000000000000000000000000000000000000005f5bffb0000000000000000000000000000000000000000000000000000000005f5bffb0000000000000000000000000000000000000000000000000000000005f5bffb0000000000000000000000000000000000000000000000000000000005f5c5a80000000000000000000000000000000000000000000000000000000005f5c5a80000000000000000000000000000000000000000000000000000000000000006347463b045f4a2d32c383c6a3ecd11bca38ce8d3c35b861996a2129f0439ce612c48117b4b48f77f037c3cc10d3364ae66a0d92aafd610400acbae96303624a4f0555b3376d7ef7b3fc3674f564cffd3478b024490fa1f3c10e31f3526cd9f13d8332cbc267482b78f02b55a6f56d369a64f269c2839213cb13dd13a55fe27492d331dacfef32e16f5aee71e33a5c4d9340905271466a559b36ae74340e33ff5a7fa9433d4cc95e0b3ffd56b6631cac08885fcf376ba01f95eaf83903f56c966000000000000000000000000000000000000000000000000000000000000000625c61abf351ff52362aad60a065303cd7d785c50158ca02d2828c746f01950766ae31763cdb7d4df9a2078438d1cb08f2b74bb4de33e8255f1ea594d3a27cc092d9f5b97f2c224a06e9e384acca540ecc515dbc0cca10041e63d141a21cb53fc1bc8015a80fa649f9348b8d3380bf73c91eb341f6afe82eb536c3085422804924c305ca777dcc5506d23d64668045bf2c2ac17e606011d17ff4f401202443a115618cea9049d94671ea68c1b1e09417ea1dd84dc4fa0427bcbef47d1f09aec110000000000000000000000000000000000000000000000000000000000000000000000000000000000000000000000000000000000000000000000000000000000000000000000000000000000000000000000000000010000000000000000000000000000000000000000000000000000000000000000010000000000000000000000000000000000000000000000000000000001568b10000000000000000000000000000000000000000000000000000000000788b53000000000000000000000000000000000000000000000000000000000000000e000000000000000000000000000000000000000000000000000000000000000001e055182027f76f2d6268defcf46c6e1f411b496a421867863fb9b56c23f3ea823417b825d5c0d8b54f48d40471af47910082199426b81791474822bdbb57d2e000000000000000000000000000000000000000000000000000000000000000000000000000000000000000000000000000000000000000000000000000008a0000000000000000000000000000000000000000000000000000000000000000100000000000000000000000000000000000000000000000000000000000212c6000000000000000000000000000000000000000000000000000000000000008000000000000000000000000000000000000000000000000000000000000007800000000000000000000000000000000000000000000000000000000000000003000000000000000000000000000000000000000000000000000000000000006000000000000000000000000000000000000000000000000000000000000004a000000000000000000000000000000000000000000000000000000000000005c0000000000000000000000000c9e1a09622afdb659913fefe800feae5dbbfe9d7000000000000000000000000000000000000000000000000000000000000006000000000000000000000000000000000000000000000000000000000000000c00000000000000000000000000000000000000000000000000000000000000002c797025feeeaf2cd924c99e9205acb8ec04d5cad21c41ce637a38fb6dee6016a000000000000000000000000000000000000000000000000000000000000048e00000000000000000000000000000000000000000000000000000000000003600000000000000000000000000000000000000000000000000000000005f5b9110000000000000000000000006d53d5e35f5226a1613877e071b81217387ac6b5000000000000000000000000000000000000000000000000000000006a9685fd0000000000000000000000000000000000000000000000000000000000000100000000000000000000000000000000000000000000000000000000000000032000000000000000000000000000000000000000000000000000000000000000000001ba57841f89e462d56961c9e46c301b4356b48ba908f2a0b4cb602a7558ec00000000000000000000000000000000000000000000000000000000009a350600000000000000000000000000000000000000000000000000000000000000100000000000000000000000000000000000000000000000000000000005f5ac0d0000000000000000000000000000000000000000000000000000000005f5ac100000000000000000000000000000000000000000000000000000000005f5ac840000000000000000000000000000000000000000000000000000000005f5ac840000000000000000000000000000000000000000000000000000000005f5b5d20000000000000000000000000000000000000000000000000000000005f5b5d20000000000000000000000000000000000000000000000000000000005f5b5d20000000000000000000000000000000000000000000000000000000005f5b5d20000000000000000000000000000000000000000000000000000000005f5b9110000000000000000000000000000000000000000000000000000000005f5ba670000000000000000000000000000000000000000000000000000000005f5ba670000000000000000000000000000000000000000000000000000000005f5bffb0000000000000000000000000000000000000000000000000000000005f5bffb0000000000000000000000000000000000000000000000000000000005f5bffb0000000000000000000000000000000000000000000000000000000005f5c5a80000000000000000000000000000000000000000000000000000000005f5c5a800000000000000000000000000000000000000000000000000000000000000100a0c0e0d0805010f04000906070b030200000000000000000000000000000000000000000000000000000000c9e1a09622afdb659913fefe800feae5dbbfe9d7000000000000000000000000000000000000000000000000000000000000006000000000000000000000000000000000000000000000000000000000000000e000000000000000000000000000000000000000000000000000000000000000030109fc6f55cf40689f02fbaad7af7fe7bbac8a3d2186600afc7d3e10cac60271000000000000000000000000000000000000000000000000000000000000048e00000000000000000000000000000000000000000000000000000000000000000000000000000000000000000000000000000000000000000000000000000020000000000000000000000000000000000000000000000000000000006a9685fd000000000000000000000000c9e1a09622afdb659913fefe800feae5dbbfe9d7000000000000000000000000000000000000000000000000000000000000006000000000000000000000000000000000000000000000000000000000000000e000000000000000000000000000000000000000000000000000000000000000030559884fd3a460db3073b7fc896cc77986f16e378210ded43186175bf646fc5f0000000000000000000000000000000000000000000000000000000005f5b911000000000000000000000000000000000000000000000000000000000000048e0000000000000000000000000000000000000000000000000000000000000020000000000000000000000000000000000000000000000000000000006a96860b000000000000000000000000000000000000000000000000000000000000010000000000000000020000080004000000000000080000000000000000000000000000000000000000000000000000000000000000000200000000000000000000000000000000000000000000002002000000000001000000000000000000000000000000020004000000000000000800000000000000000000000000000000